{
  "skill_slug": "example-lifecycle-skill",
  "display_name": "Example Lifecycle Skill",
  "description": "Create a structured local skill from questionnaire answers while preserving the full think to reflect lifecycle.",
  "when_to_use": [
    "Use when a new in-house skill should be scaffolded from a questionnaire instead of hand-writing the tmpl file.",
    "Use when the operator wants deterministic questionnaire to tmpl generation with lifecycle preservation."
  ],
  "triggers": [
    "create a new skill from answers",
    "generate tmpl from questionnaire",
    "preserve full lifecycle in the new skill"
  ],
  "jobs_to_be_done": [
    "turn answered questions into a valid SKILL.md.tmpl source file",
    "carry the tmpl forward into deterministic skill generation",
    "keep think, plan, build, review, test, ship, and reflect explicit"
  ],
  "workflow": {
    "preserve_lifecycle": true,
    "notes": [
      "Do not collapse the lifecycle into a shorter loop.",
      "Allow light local adaptation but keep all lifecycle stages visible."
    ]
  },
  "inputs": [
    "questionnaire answers json",
    "optional local notes about scripts and references"
  ],
  "outputs": [
    "SKILL.md.tmpl",
    "generated SKILL.md",
    "skeleton resource directories when requested"
  ],
  "resources": {
    "scripts": ["render_skill_from_answers.py"],
    "references": ["questionnaire-template.json"],
    "assets": []
  },
  "constraints": [
    "stay local-first",
    "avoid ghost files",
    "make generated artifacts reproducible and removable"
  ],
  "testing": {
    "checks": [
      "validate questionnaire structure",
      "render deterministic tmpl output",
      "generate final SKILL.md",
      "verify lifecycle sections are present"
    ],
    "evidence": [
      "fixture answers file",
      "rendered tmpl file",
      "generated markdown file",
      "test report"
    ]
  },
  "host_notes": [
    "Keep JinClaw as control plane.",
    "Use compat adapters rather than replacing local governance."
  ]
}
